{
  "style_version": "1.0.0",
  "style_name": "Chromatic Gesture Characters — Part 4",
  "style_slug": "chromatic-gesture-characters-part-04",
  "style_summary": "Part 4 of Chromatic Gesture Characters: continues the large geometric bodies, hot-pink clashes, minimal black faces and grainy print feel with pottery throwing, kite flying, accordion playing and a stretching cat.",
  "environment_variables": {
    "ASPECT_RATIO": "9:16 or 16:9",
    "STYLE_FIDELITY_ANCHORS": "Runtime joined CORE and FLEX anchors from this spec",
    "SOURCE_CONTENT_TO_AVOID": "Runtime joined source-specific content exclusions",
    "SUBJECT": "New character identity and a small number of theme-bearing objects",
    "ACTION": "Readable physical interaction and emotional expression",
    "DESIGN_DIRECTION": "The case concept and its visible contribution to hierarchy and silhouette",
    "PALETTE_DIRECTION": "Roles of saturated colors within the shared chromatic system",
    "MAIN_TEXT": "Only visible wording, exact uppercase spelling without added punctuation",
    "PORTRAIT_PLAN": "Composition intention for the 9:16 image",
    "LANDSCAPE_PLAN": "Composition intention for the 16:9 image",
    "SUBJECT_ACTION": "the readable physical interaction and emotional expression described in ACTION",
    "PRODUCT_OR_PROP": "one or two oversized theme-bearing objects that join the character silhouette",
    "LOCATION": "edge-to-edge off-white paper with no scene; depth implied only by overlapping shapes",
    "BACKGROUND_ELEMENTS": "bare paper gaps, selective grainy airbrushed shadow and the small black caption",
    "SECONDARY_TEXT": "none; MAIN_TEXT is the only visible wording",
    "ACCENT_SYMBOL": "the minimal black cut-paper facial marks",
    "WARDROBE_STYLE": "flat sculptural garment blocks in hot pink, coral red, cobalt and emerald"
  },
  "style_fidelity_anchors": [
    "[CORE] Build a monumental, asymmetric character silhouette from few interlocking circles, flattened capsules, wedges, tapered limbs and large flowing contour cuts; enlarge anatomy according to the emotional gesture.",
    "[CORE] Use nearly black, radically reduced facial marks and weight-bearing accents; eyes, brows and mouth read as deliberately cut graphic shapes rather than detailed drawing.",
    "[CORE] Pair a dominant hot pink or magenta color field with one adjacent warm red or coral gradient and two saturated cool counterweights, on an open off-white paper ground.",
    "[CORE] Keep most shapes flat and crisply bounded, with localized dark-to-color airbrushed shading at overlaps or bends and the specified fine print texture; depth must remain graphic.",
    "[CORE] Let the character-object interaction carry the poster; sparse small bold black uppercase sans-serif copy occupies a useful pocket of negative space.",
    "[FLEX] Change pose, gaze, crop, size relationships and title location to make the action legible; a full body, profile crop, enclosing gesture or reclining arrangement are equally valid.",
    "[FLEX] Let a clay vessel and wheel, a diamond kite, accordion bellows, or a stretching cat and low step transform silhouette and negative space as part of the story, with no decorative prop pile.",
    "[FLEX] Recompose portrait and landscape around their available width and height; preserve the case's conceptual relationship while changing overlaps and focal placement."
  ],
  "source_content_to_avoid": [
    "The original angry seated man with enormous sideways ear, black side-parted hair and crossed short legs",
    "The two white pointed steam puffs issuing from nostrils",
    "The exact phrase A LITTLE(BIG) MAD. and all source wording",
    "The small oval creator stamp, source signature, watermark or brand identity",
    "The original green sleeves, blue trousers, pink head and large black shoes repeated in the same placement",
    "Part 1 content: saxophone player and puffed cheek, giant pear embrace, umbrella dance, reclining reader and giant book; replace their subjects, actions and wording.",
    "Part 2 content: baker stretching dough, bicycle rider, giant dog and walker, frontal photographer and camera; replace their subjects, actions and captions.",
    "Part 3 content: topiary gardener and shears, freediver with water ribbon, chess player and giant knight, mover with three-box stack; replace these subjects, actions and captions."
  ],
  "visual_deconstruction": {
    "source_observations": "The source enlarges the head and ear into a compressed standing monument. The tiny two-line caption is secondary. Magenta cheeks shift into red forehead; curved black mouth and slanted brows establish anger. Green and cobalt body forms stabilize the composition. White steam marks carve the figure.",
    "reusable_system": "Emotion becomes shape, not facial detail. Scale contrast, black cut-shape expressions, complementary saturated blocks, grainy localized gradients and sparse paper space are transferable.",
    "scope": "Part 4 of the established series. Preserve the shared rendering, palette relationships, small captions and exaggerated gesture while introducing pottery, kite flying, accordion playing and an independent animal character. Avoid reusing the prior twelve subject-action concepts."
  },
  "composition": {
    "hierarchy": "Gesture silhouette first, face/object relationship second, small caption third. Keep visual complexity low.",
    "negative_space": "Use paper gaps to separate limbs and objects and to carry the caption; no decorative panel framing.",
    "ratio_adaptation": "Use the applicable case plan. Portrait may stack or climb; landscape may unfold or stretch. Do not crop a finished portrait to fill the landscape."
  },
  "typography": {
    "family": "Compact bold grotesk sans-serif, plain black uppercase",
    "role": "Small editorial aside, approximately 4 to 7 percent of image height as a complete text block, subordinate to the illustration",
    "copy": "Render MAIN_TEXT verbatim once. Line breaks are flexible; no additional punctuation, byline, labels or fabricated logo."
  },
  "color_palette": {
    "paper": "#F3F1EB",
    "ink": "#10100F",
    "hot_pink": "#F553D2",
    "warm_red": "#F42726",
    "cobalt": "#293EA1",
    "emerald": "#13785D",
    "relationships": "Hot pink plus warm gradient against emerald and cobalt; roles may shift per case. Use off-white as active negative space and near-black as graphic weight."
  },
  "image_treatment": {
    "medium": "Raster illustration with the shape economy of cut-paper and airbrushed screen print",
    "texture": "Fine, low-contrast stochastic halftone-like ink stipple and paper tooth, approximately 1 to 3 pixels at a 1500-pixel short edge. Most visible inside saturated and black shapes; very faint in the off-white background. Dark grain concentrates in shaded overlaps. No large scratches, folds, distress or coarse canvas weave.",
    "edges_and_light": "Crisp contour silhouettes, softly diffused interior gradient shadows limited to overlaps and volume turns; matte ink, no glossy 3D illumination."
  },
  "design_rules": [
    "Each case must turn its action into a distinct silhouette and meaningful negative-space relationship.",
    "Keep limb and hand anatomy intentionally simplified but physically readable; no accidental extra appendages.",
    "Objects must participate in the gesture at an expressive scale instead of floating as accessories.",
    "Keep the exact short caption clearly readable with generous separation from the focal face and object.",
    "Produce a full-bleed artwork on off-white paper, without a framed mockup or photographic scene.",
    "Keep color count controlled and reduce background detail to marks necessary for the case."
  ],
  "do": [
    "Use large asymmetric masses with small facial marks.",
    "Use white gaps as structural parts of the gesture.",
    "Recompose both ratios deliberately.",
    "Keep texture integrated with ink and preserve clean silhouette contours."
  ],
  "avoid": [
    "Copying the source character, angry pose, steam icons or signature.",
    "Photorealistic people, shiny toy renderings, generic cute mascots or outlined cartoons.",
    "Huge headline typography, dense labels, decorative stars and extra logos.",
    "Four identical centered seated poses with different accessories."
  ],